id,everyday_word,transformed_word,everyday_sentence,improved_sentence_1,improved_sentence_2,difficulty_level,synonyms,usage_note,english_meaning,challenge_prompt,tags
karya,kaam,karya,"Aaj ka kaam thoda zyada hai, par shaam tak ho jayega.","Aaj karya thoda adhik hai, par shaam tak poora ho jayega.","Aaj karya-bhaar adhik avashya hai, phir bhi ise sandhya tak sampann kar lenge.",easy,kaarya | kartavya | prayojan,"Karya gives ordinary work a composed, purposeful tone without sounding heavy.","work, task, or purposeful action",Aaj ke kisi mahatvapurn karya par ek spasht vaakya banaiye.,work | daily speech | professional
prayas,koshish,prayas,"Main kal se koshish kar raha hoon, aaj shayad baat ban jaaye.","Maine kal se prayas jaari rakha hai, aaj shayad baat ban jaaye.",Mera prayas nirantar raha hai; sambhav hai aaj iska sukhad parinaam mile.,easy,yatna | mehnat | chesta,"Prayas is graceful in speech and writing, especially when describing sincere effort.",effort or attempt,Kisi aise prayas ka zikr kijiye jisse aapko sudhaar mehsoos hua.,effort | self improvement | daily speech
sheeghra,jaldi,sheeghra,"Zara jaldi bata dena, mujhe nikalna bhi hai.","Kripya sheeghra bata dijiye, mujhe nikalna bhi hai.","Kripya sheeghra suchit karein, kyunki mujhe prasthaan bhi karna hai.",easy,turant | tatkaal | jaldi,Sheeghra feels courteous and precise; use it when speed matters but the tone should stay calm.,"soon, quickly, or without delay",Sheeghra shabd ka prayog karte hue kisi vinamra nivedan ka vaakya kahiye.,time | polite speech | requests
arth,matlab,arth,"Achchha, tumhari is baat ka matlab kya hai?","Achchha, aapki is baat ka arth kya hai?","Kripya spasht kijiye, aapke kathan ka vaastavik arth kya hai?",easy,maayne | bhaav | tatparya,"Arth is concise and elegant, useful whenever you are clarifying meaning.",meaning or significance,Arth shabd ka prayog karte hue kisi vichaar ko samjhaiye.,meaning | clarity | conversation
arthaat,yaani,arthaat,"Yaani kal sabko thoda jaldi aana hai, theek?","Arthaat kal sabko thoda sheeghra aana hai, sahi?","Arthaat sabhi ko kal nirdharit samay se poorv upasthit hona hai, hai na?",medium,yaani | tatparya yeh hai | is arth mein,Arthaat is best for explaining or restating a point with poise.,"that is, namely, or in other words",Arthaat ka prayog karke kisi baat ko aur spasht kijiye.,clarity | explanation | formal
vichaar,soch,vichaar,Meri soch yeh hai ki pehle chhota sa trial kar lete hain.,Mera vichaar hai ki pehle ek chhota parikshan kar lete hain.,Mera vichaar hai ki poorn kriyanvayan se pehle seemit star par parikshan uchit rahega.,easy,raay | manan | drishti,"Vichaar sounds mature and reflective, especially for opinions and ideas.","thought, idea, or considered view",Kisi vishay par apna vichaar ek santulit vaakya mein kahiye.,ideas | opinion | reflection
drishtikon,nazariya,drishtikon,"Main tumhara nazariya samajh raha hoon, bas ek chinta hai.","Main aapka drishtikon samajh raha hoon, keval ek chinta hai.",Main aapke drishtikon ka samman karta hoon; tathapi ek bindu par meri chinta bani hui hai.,medium,drishti | raay | pariprekshya,Drishtikon is ideal for thoughtful discussions where perspective matters.,perspective or point of view,Apne drishtikon ko ek vinamra vaakya mein vyakt kijiye.,perspective | discussion | professional
uchit,sahi,uchit,Abhi phone karna sahi rahega ya thoda ruk jaaun?,Abhi phone karna uchit rahega ya kuch der pratiksha karoon?,"Kya is samay sampark karna uchit hoga, athva mujhe kuch samay pratiksha karni chahiye?",easy,upayukt | theek | anukul,Uchit adds tact when you want to say something is right or suitable.,"appropriate, proper, or suitable",Uchit shabd ka prayog karke kisi salah ka vaakya banaiye.,judgment | advice | polite speech
avashyak,zaroori,avashyak,"Kal aana zaroori hai kya, ya online ho jayega?","Kya kal aana avashyak hai, ya kaam online ho jayega?","Kya kal vyaktigat roop se upasthit hona avashyak hai, athva karya online sampann ho sakta hai?",easy,aavashyak | anivarya | mahatvapurn,Avashyak sounds clear and composed without becoming too formal.,necessary or essential,Kisi avashyak kaam ke baare mein ek seedha vaakya kahiye.,importance | clarity | daily speech
sahayata,madad,sahayata,"Ek minute, is form mein tumhari madad chahiye.","Ek kshan, is form ko bharne mein aapki sahayata chahiye.",Kripya is prapatra ko poora karne mein meri sahayata karein; ek bindu spasht nahi hai.,easy,madad | sahyog | samarthan,Sahayata keeps a request respectful and elegant.,help or assistance,Sahayata maangte hue ek vinamra vaakya taiyar kijiye.,help | requests | polite speech
samasya,problem,samasya,"Yaar, login mein phir problem aa rahi hai.",Login mein phir se ek samasya aa rahi hai.,Pravesh karte samay samasya punah utpann ho rahi hai; kripya takneeki jaanch kar dein.,easy,pareshani | dikkat | vighn,Samasya replaces English-mixed phrasing cleanly while staying common in spoken Hindi.,"problem, issue, or difficulty",Kisi chhoti samasya ko shaant bhaav se varnit kijiye.,problem solving | professional | daily speech
samadhan,solution,samadhan,"Chalo, is dikkat ka koi simple solution dhoondhte hain.","Aaiye, is samasya ka koi saral samadhan dhoondhte hain.","Aaiye, is samasya ka vyavaharik samadhan talaashein, jise turant apnaya ja sake.",easy,hal | upay | nivarana,"Samadhan is natural in meetings, planning, and thoughtful conversation.",solution or resolution,Samadhan shabd ka prayog karte hue kisi upay ka vaakya kahiye.,problem solving | professional | clarity
spasht,clear,spasht,"Ab tumhari baat clear hai, pehle thodi uljhan thi.","Ab aapki baat spasht hai, pehle thodi uljhan thi.",Ab aapka drishtikon poori tarah spasht hai; aarambh mein kuch aspashtata thi.,easy,saaf | prakat | sugam,Spasht is a useful everyday upgrade for clarity without sounding stiff.,"clear, evident, or explicit",Spasht shabd ke saath kisi nirdesh ya vichaar ko kahiye.,clarity | communication | professional
aspashtata,confusion,aspashtata,"Is message mein thodi confusion hai, date samajh nahi aa rahi.","Is sandesh mein kuch aspashtata hai, tareekh samajh nahi aa rahi.",Sandesh mein tareekh ko lekar aspashtata hai; kripya nishchit dinank bata dein.,medium,uljhan | asmanjas | sandigdhata,"Aspashtata names confusion gracefully, especially when you want to stay diplomatic.",lack of clarity or ambiguity,Aspashtata door karne ke liye ek vinamra vaakya banaiye.,clarity | meetings | professional
nirnay,faisla,nirnay,"Toh, aaj final faisla kar lein ya kal tak rukhein?","Toh, aaj antim nirnay lein ya kal tak pratiksha karein?","Kya hum aaj hi antim nirnay lein, athva vichaar ke liye kal tak ka samay rakhein?",easy,faisla | nishchay | tai,Nirnay is elegant and common enough for everyday formal speech.,decision,Nirnay shabd ka prayog karte hue ek sthir vaakya kahiye.,decision | planning | professional
samay,time,samay,"Aaj time kam hai, baaki baat shaam ko karte hain.","Aaj samay kam hai, shesh baat shaam ko karte hain.",Aaj samay seemit hai; atah shesh charcha sandhya mein karna uchit rahega.,easy,waqt | avasar | ghadi,Samay is one of the easiest upgrades from English-mixed everyday Hindi.,time,Samay ka samman dikhate hue ek chhota vaakya kahiye.,time | daily speech | planning
avasar,mauka,avasar,Agli baar mujhe bhi bolne ka mauka dena.,Agli baar mujhe bhi bolne ka avasar dijiye.,Agli baithak mein mujhe bhi apna drishtikon rakhne ka avasar pradaan kijiye.,easy,mauka | sandhi | avkaash,Avasar sounds optimistic and cultured while staying easy to understand.,opportunity or occasion,Kisi naye avasar ke baare mein ek utsaahbhara vaakya kahiye.,opportunity | growth | positive
sambhav,possible,sambhav,Thoda time mile toh yeh kaam possible hai.,Thoda samay mile toh yeh karya sambhav hai.,"Yadi kuch atirikt samay mile, toh is karya ko gunvatta ke saath poora karna sambhav hai.",easy,mumkin | sakya | ho sakta hai,Sambhav keeps the sentence Hindi-forward and confident.,possible or feasible,Sambhav shabd ka prayog karte hue kisi yojana par vaakya banaiye.,planning | confidence | professional
asambhav,impossible,asambhav,"Aaj hi sab karna impossible hai, kal subah tak de do.","Aaj hi sab poora karna asambhav hai, kal subah tak ka samay dijiye.",Sampoorna karya aaj hi sampann karna asambhav hai; kripya kal pratah tak ki avadhi dein.,medium,namumkin | durlabh | akarya,Asambhav is direct but composed; pair it with a reason for a softer tone.,impossible or not feasible,Asambhav shabd ka prayog karte hue ek vinamra seema batayiye.,limits | planning | professional
sujhav,suggestion,sujhav,Ek suggestion doon? Pehle customer se pooch lete hain.,Ek sujhav doon? Pehle grahak se pooch lete hain.,Mera sujhav hai ki nirnay se poorv grahak ki apekshaen spasht roop se jaan li jaayen.,easy,salah | paramarsh | raay,Sujhav sounds collaborative and clear in group conversations.,suggestion or recommendation,Sujhav dete hue ek sahaj aur vinamra vaakya kahiye.,advice | collaboration | professional
uttar,jawab,uttar,"Maine kal poocha tha, abhi tak jawab nahi aaya.","Maine kal prashn bheja tha, abhi tak uttar nahi aaya.","Maine kal prashn preshit kiya tha, parantu abhi tak koi uttar praapt nahi hua.",easy,pratikriya | jawab | samadhan,Uttar is especially good when asking or responding politely.,answer or response,Uttar shabd ka prayog karte hue ek prashn ka sandarbh dijiye.,response | communication | polite speech
prashn,sawaal,prashn,Ek sawaal hai—yeh rule sab par lagega kya?,Ek prashn hai—kya yeh niyam sab par lagu hoga?,Mera ek prashn hai: kya yeh niyam bina kisi apavaad ke sabhi par lagu hoga?,easy,sawaal | jigyasa | puchh-taach,"Prashn is familiar, clean, and suitable for classrooms, meetings, and talks.",question,Prashn shabd ka prayog karte hue ek vinamra sawaal poochhiye.,questions | learning | communication
uttam,bahut achchha,uttam,"Wah, tumne bahut achchha kaam kiya hai!","Wah, aapne uttam karya kiya hai!",Aapka karya vaastav mein uttam hai; ismein parishram aur sookshmata dono dikhte hain.,easy,shreshth | badhiya | sarvottam,Uttam is appreciative and refined; use it for genuine praise.,excellent or very good,Uttam shabd ka prayog karte hue kisi ka sarahniya kaam batayiye.,praise | positive | daily speech
sundar,achchha,sundar,"Tumne bahut achchha samjhaya, sabko baat samajh aa gayi.","Aapne bahut sundar dhang se samjhaya, sabko baat samajh aa gayi.",Aapki sundar aur sugam vyakhya se vishay sabhi ke liye poori tarah spasht ho gaya.,easy,manohar | sushobhit | sajag,"Sundar can praise words, ideas, or gestures, not only appearance.","beautiful, graceful, or pleasant",Sundar shabd ka prayog karke kisi vichaar ki prashansa kijiye.,praise | expression | positive
sahaj,easy,sahaj,"App use karna easy hai, mummy bhi chala leti hain.","App ka upyog sahaj hai, mummy bhi ise chala leti hain.",Is app ka upyog itna sahaj hai ki takneek se kam parichit vyakti bhi ise aasani se chala sakta hai.,easy,saral | sugam | prakritik,Sahaj is warmer than easy and suggests natural simplicity.,"easy, natural, or effortless",Sahaj shabd ka prayog karte hue kisi prakriya ko varnit kijiye.,ease | process | daily speech
kathin,mushkil,kathin,"Yeh chapter thoda mushkil hai, saath mein padhte hain.","Yeh adhyay thoda kathin hai, aaiye saath mein padhte hain.","Yeh adhyay kathin avashya hai, par saath milkar padhenge toh samajhna sugam hoga.",easy,dushkar | kashtkar | jatil,Kathin is clear and balanced; it names difficulty without sounding dramatic.,difficult or demanding,Kathin shabd ka prayog karte hue kisi chunauti par vaakya kahiye.,difficulty | challenge | daily speech
sankalp,iraada,sankalp,Is saal mera iraada roz aadha ghanta padhne ka hai.,Is varsh mera sankalp roz aadha ghanta padhne ka hai.,Is varsh maine pratidin aadha ghanta adhyayan karne ka dridh sankalp liya hai.,medium,nishchay | pratigya | dridh ichchha,Sankalp adds strength and dignity when speaking about commitment.,resolve or firm intention,Apne kisi sankalp ko ek saaf vaakya mein vyakt kijiye.,commitment | self improvement | motivation
anubhav,experience,anubhav,Trip kaisi thi? Mera experience toh kaafi achchha raha.,Yatra kaisi thi? Mera anubhav kaafi achchha raha.,Yatra mere liye atyant sukhad anubhav rahi; maine bahut kuch naya bhi seekha.,easy,tajurba | anubhuti | gyaan,Anubhav is natural in both personal reflection and professional settings.,experience,Kisi yaadgaar anubhav ke baare mein ek vaakya kahiye.,experience | reflection | daily speech
samvaad,baatcheet,samvaad,Is baat par shaant hokar baatcheet kar lete hain.,Is vishay par shaant hokar samvaad kar lete hain.,Matbhed door karne ke liye is vishay par shaant aur khula samvaad karna uchit rahega.,medium,vaarta | baatcheet | charcha,"Samvaad suggests respectful exchange, not just casual talking.",dialogue or meaningful conversation,Samvaad shabd ka prayog karke kisi zaroori baatcheet ka zikr kijiye.,conversation | respect | collaboration
charcha,discussion,charcha,Kal meeting mein budget par discussion karenge.,Kal baithak mein budget par charcha karenge.,Kal ki baithak mein budget ke pramukh binduon par vistaar se charcha ki jayegi.,easy,samvaad | vichar-vimarsh | vaarta,"Charcha is familiar and elegant for meetings, classes, and family decisions.",discussion or deliberation,Charcha shabd ka prayog karte hue kisi vishay ka ullekh kijiye.,discussion | meetings | learning
vishay,topic,vishay,"Aaj ka topic thoda serious hai, dhyaan se sunna.","Aaj ka vishay thoda gambhir hai, dhyaan se suniye.",Aaj ka vishay gambhir aur samvedansheel hai; kripya ekagrata se suniye.,easy,mudda | prasang | adhyay,Vishay is a clean replacement for topic in most Hindi conversations.,topic or subject,Vishay shabd ke saath kisi charcha ka aarambh kijiye.,topic | learning | clarity
rochak,interesting,rochak,"Yeh podcast kaafi interesting hai, tum bhi sunna.","Yeh podcast kaafi rochak hai, aap bhi suniyega.",Yeh podcast atyant rochak hai; ismein vishay ko anek naye drishtikon se samjhaya gaya hai.,easy,dilchasp | manohar | akarshak,Rochak is lively but still elegant; it works well for stories and ideas.,interesting or engaging,Rochak shabd ka prayog karte hue kisi kahani ya vichaar ka varnan kijiye.,interest | stories | expression
mahatvapurn,important,mahatvapurn,"Kal ki meeting important hai, miss mat karna.","Kal ki baithak mahatvapurn hai, kripya chhodiye mat.",Kal ki baithak atyant mahatvapurn hai; aapki upasthiti avashyak rahegi.,easy,avashyak | pramukh | mool,Mahatvapurn is useful when you want emphasis without exaggeration.,important or significant,Mahatvapurn shabd ka prayog karte hue kisi prathamikta ko batayiye.,importance | professional | planning
pramukh,main,pramukh,Abhi hamara main focus delivery time par hai.,Abhi hamara pramukh dhyaan vitran ke samay par hai.,Vartamaan mein hamara pramukh lakshya nirdharit samay par gunvattapurn vitran sunishchit karna hai.,easy,mukhya | mool | kendriya,Pramukh helps replace English-mixed main while keeping the sentence concise.,"main, chief, or primary",Pramukh shabd ke saath apni kisi priority ka vaakya banaiye.,priority | planning | professional
lakshya,goal,lakshya,Mera goal hai ki is mahine roz Hindi boloon.,Mera lakshya hai ki is maheene roz Hindi boloon.,Is maas mera lakshya pratidin Hindi mein samvaad karke apni abhivyakti ko sahaj banana hai.,easy,uddeshya | manzil | dhyey,Lakshya feels purposeful and is common in aspirational speech.,goal or objective,Apne kisi lakshya ko ek prernaadayak vaakya mein kahiye.,goals | motivation | self improvement
uddeshya,purpose,uddeshya,"Is exercise ka purpose kya hai, zara samjhaoge?","Is abhyas ka uddeshya kya hai, zara samjhaiye?",Kripya spasht kijiye ki is abhyas ka uddeshya kya hai aur isse humein kya laabh milega.,medium,maqsad | prayojan | lakshya,Uddeshya adds depth when explaining why something matters.,purpose or intent,Uddeshya shabd ka prayog karte hue kisi kaam ka kaaran batayiye.,purpose | clarity | reflection
parinaam,result,parinaam,"Mehnat ka result achchha aaya, sab khush hain.","Parishram ka parinaam achchha raha, sab prasann hain.","Nirantar parishram ka parinaam utsaahjanak raha, jisse poori team prasann hai.",easy,natija | phal | prabhav,"Parinaam is elegant and familiar, especially for outcomes and consequences.",result or outcome,Parinaam shabd ka prayog karte hue kisi kriya ka asar batayiye.,results | consequence | professional
prabhav,impact,prabhav,Is change ka team par bada impact padega.,Is parivartan ka team par bada prabhav padega.,Is parivartan ka team ki karyapranali aur manobal par vyaapak prabhav pad sakta hai.,medium,asar | parinaam | prerak bal,"Prabhav is strong but natural, useful for decisions and communication.","impact, influence, or effect",Prabhav shabd ka prayog karke kisi nirnay ke asar ko kahiye.,impact | decision | professional
sambandh,relation,sambandh,Is baat ka hamare issue se kya relation hai?,Is baat ka hamari samasya se kya sambandh hai?,Kripya spasht karein ki is tathya ka vartamaan samasya se kya pratyaksh sambandh hai.,easy,rishta | jod | nataa,"Sambandh neatly expresses connection between ideas, people, or topics.",relationship or connection,Sambandh shabd ka prayog karte hue do baaton ko jodiye.,connection | ideas | communication
vishwas,trust,vishwas,"Mujhe tum par trust hai, tum sambhaal loge.","Mujhe aap par vishwas hai, aap ise sambhaal lenge.",Mujhe aapki kshamata par poorn vishwas hai; aap yeh zimmedari kushalta se nibha lenge.,easy,bharosa | aastha | shraddha,"Vishwas is warm, direct, and suitable for personal or professional trust.",trust or belief,Vishwas shabd ka prayog karte hue ek sakaratmak vaakya kahiye.,trust | relationships | positive
aadar,respect,aadar,"Main unki mehnat ka respect karta hoon, sach mein.","Main unke parishram ka aadar karta hoon, sach mein.",Main unke nirantar parishram aur samarpan ka hriday se aadar karta hoon.,easy,samman | maan | shraddha,Aadar is slightly softer than samman and works well for sincere appreciation.,respect or regard,Aadar shabd ka prayog karke kisi ki mehnat ko sarahiye.,respect | relationships | appreciation
samman,izzat,samman,"Baat chahe jo ho, sabki izzat karni chahiye.","Matbhed chahe jo ho, sabka samman karna chahiye.","Vichaaron mein matbhed ho sakta hai, phir bhi pratyek vyakti ka samman bana rehna chahiye.",easy,aadar | maan | gaurav,Samman is dignified and widely understood in everyday speech.,honor or respect,Samman shabd ke saath ek samvedansheel vaakya kahiye.,respect | values | daily speech
sanyam,control,sanyam,Gussa aa raha ho toh thoda control rakhna.,Gussa aaye toh thoda sanyam rakhna.,Kathin paristhiti mein bhi sanyam banaye rakhna samajhdari aur paripakvata ka parichay hai.,medium,niyantran | dhairya | santulan,Sanyam is elegant for emotional balance and disciplined conduct.,"restraint, composure, or self-control",Sanyam shabd ka prayog karte hue kisi kathin pal ka varnan kijiye.,emotion | discipline | values
dhairya,patience,dhairya,"Thoda patience rakho, kaam bas hone wala hai.","Thoda dhairya rakhiye, karya bas poora hone wala hai.",Kripya kuch aur dhairya rakhein; karya antim charan mein hai aur sheeghra sampann ho jayega.,easy,sabr | sahan-shakti | sanyam,"Dhairya feels steady and thoughtful, especially during challenges.",patience or calm endurance,Dhairya shabd ka prayog karte hue ek shaant salah dijiye.,patience | challenge | values
sahas,himmat,sahas,"Jo sahi hai woh bolo, thodi himmat dikhao.","Jo uchit hai woh kahiye, thoda sahas dikhaiye.",Paristhiti kathin ho tab bhi satya ke paksh mein bolne ka sahas rakhiye.,easy,himmat | veerata | nirbhayata,"Sahas gives courage a dignified, inspiring tone.",courage,Sahas shabd ka prayog karte hue kisi sahi nirnay ka zikr kijiye.,courage | values | motivation
zimmedari,responsibility,zimmedari,"Yeh meri responsibility hai, main dekh lunga.","Yeh meri zimmedari hai, main ise sambhaal loonga.",Is karya ki poori zimmedari meri hai; main ise samay par aur theek dhang se poora karunga.,easy,uttardayitva | kartavya | farz,"Zimmedari is natural, strong, and useful for ownership.",responsibility or accountability,Zimmedari shabd ka prayog karte hue apni bhumika batayiye.,responsibility | work | values
vinamra,polite,vinamra,Tumhara tone thoda polite rahe toh baat ban jayegi.,Aapka swar thoda vinamra rahe toh baat ban jayegi.,"Yadi aapka swar vinamra aur shabd santulit hon, toh samvaad adhik prabhavi rahega.",easy,namra | sabhya | shisht,"Vinamra is excellent for describing tone, requests, and behavior.",polite or humble,Vinamra shabd ka prayog karte hue ek nivedan kijiye.,politeness | tone | requests
sabhya,decent,sabhya,"Party mein sabka behavior decent tha, achchha laga.","Samaaroh mein sabka vyavahar sabhya tha, achchha laga.",Samaaroh mein sabhi ka sabhya aur maryadit vyavahar dekhkar prasannata hui.,medium,shisht | sanskari | vinamra,Sabhya describes conduct that is courteous and socially graceful.,"civil, courteous, or refined",Sabhya shabd ke saath achchhe vyavahar ka vaakya banaiye.,conduct | politeness | values
vyavahar,behavior,vyavahar,"Woh senior hain, par unka behavior bilkul friendly hai.","Woh varishth hain, par unka vyavahar bahut mitravat hai.","Varishth pad par hote hue bhi unka vyavahar sahaj, vinamra aur sahyogpoorn hai.",easy,aacharan | bartav | ravayya,"Vyavahar is common and refined, useful for personal and social settings.",behavior or conduct,Vyavahar shabd ka prayog karte hue kisi gun ka varnan kijiye.,conduct | relationships | daily speech
parivartan,change,parivartan,"Routine mein thoda change chahiye, bore ho gaya hoon.","Dinacharya mein thoda parivartan chahiye, main oob gaya hoon.",Ekrasata door karne ke liye dinacharya mein sakaratmak parivartan laana avashyak lagta hai.,easy,badlav | rupantaran | sanshodhan,"Parivartan sounds constructive, especially for improvement and reform.",change or transformation,Parivartan shabd ka prayog karke kisi sudhaar ka zikr kijiye.,change | improvement | planning
sudhaar,improvement,sudhaar,"Presentation achchhi hai, bas opening mein improvement chahiye.","Prastuti achchhi hai, bas aarambh mein sudhaar chahiye.",Prastuti prabhavi hai; keval prarambhik bhaag mein kuch sudhaar se iska prabhav aur badh sakta hai.,easy,unnati | sansthan | behtari,Sudhaar is supportive and practical; it fits the app's aspirational tone.,improvement or correction,Sudhaar shabd ka prayog karte hue ek rachanatmak vaakya kahiye.,improvement | learning | feedback
unnati,progress,unnati,Tumhari Hindi mein progress saaf dikh rahi hai.,Aapki Hindi mein unnati spasht dikh rahi hai.,Aapki Hindi mein nirantar unnati dikh rahi hai; abhivyakti pehle se adhik sahaj aur spasht hai.,easy,pragati | vikas | sudhaar,Unnati has an aspirational quality and works beautifully for learning.,progress or advancement,Unnati shabd ka prayog karte hue apni seekh par vaakya kahiye.,progress | learning | motivation
yojana,plan,yojana,"Weekend ka plan kya hai, kahin bahar chalna hai?","Saptaahant ki yojana kya hai, kahin bahar chalna hai?",Saptaahant ke liye kya yojana hai? Yadi sab sahmat hon toh ek chhoti yatra rakhi ja sakti hai.,easy,rananeeti | vidhi | karyakram,Yojana is a natural Hindi replacement for plan in everyday contexts.,plan or scheme,Yojana shabd ka prayog karte hue agle kadam ka varnan kijiye.,planning | work | daily speech
disha,direction,disha,Team ko clear direction mil jaaye toh kaam tez hoga.,Team ko spasht disha mil jaaye toh karya tez hoga.,"Team ko spasht disha aur nirdharit prathamiktaen milen, toh karya adhik kushalta se aage badhega.",easy,marg | raah | nirdesh,"Disha is concise and graceful for guidance, planning, or purpose.",direction or guiding path,Disha shabd ka prayog karte hue kisi margdarshan par vaakya kahiye.,guidance | planning | leadership
margdarshan,guidance,margdarshan,Is career decision mein aapki guidance chahiye.,Is career nirnay mein aapka margdarshan chahiye.,Is mahatvapurn jeevan-vritti nirnay mein aapka anubhavi margdarshan mere liye atyant upyogi hoga.,medium,salah | disha | paramarsh,Margdarshan is respectful and warm when seeking advice from someone experienced.,guidance or direction,Margdarshan maangte hue ek vinamra vaakya kahiye.,guidance | respect | learning
paramarsh,advice,paramarsh,Investment se pehle expert ki advice le lete hain.,Nivesh se pehle visheshagya ka paramarsh le lete hain.,Vittiya nirnay lene se poorv kisi anubhavi visheshagya ka paramarsh praapt karna uchit rahega.,medium,salah | sujhav | margdarshan,Paramarsh is more formal than salah and suits thoughtful or expert advice.,counsel or considered advice,Paramarsh shabd ka prayog karte hue kisi se salah maangiye.,advice | formal | learning
santulan,balance,santulan,Kaam aur ghar ka balance banana mushkil ho raha hai.,Karya aur ghar ke beech santulan banana kathin ho raha hai.,Vyavasaayik zimmedariyon aur parivaarik jeevan ke beech santulan banaye rakhna chunautipurn ho raha hai.,medium,samanjasya | sanyam | santushti,"Santulan is elegant and useful for lifestyle, tone, and judgment.",balance or equilibrium,Santulan shabd ka prayog karte hue jeevan ya kaam par vaakya kahiye.,balance | life | reflection
abhivyakti,expression,abhivyakti,Jab tum dheere bolte ho toh expression clear rehti hai.,Jab aap dheere bolte hain toh abhivyakti spasht rehti hai.,"Santulit gati se bolne par aapki abhivyakti adhik spasht, prabhavi aur sahaj lagti hai.",medium,prakatikaran | vyakti | bolne ka dhang,Abhivyakti is central to elegant speech and works well for language learning.,expression or articulation,Abhivyakti shabd ka prayog karte hue bhasha ke mahatva par vaakya kahiye.,expression | language | learning
upyogi,helpful,upyogi,"Yeh tip kaafi helpful hai, main aaj hi try karunga.","Yeh sujhav kaafi upyogi hai, main aaj hi apnaunga.",Yeh sujhav atyant upyogi aur vyavaharik hai; main ise aaj se hi apne abhyas mein shamil karunga.,easy,laabhdayak | sahayak | kaam ka,"Upyogi is a crisp upgrade for helpful, especially in practical contexts.",useful or helpful,Upyogi shabd ka prayog karte hue kisi salah ki prashansa kijiye.,useful | advice | positive
